week,category,weekly_rank,weekly_hours_viewed,cumulative_weeks_in_top_10,Show_title,type,description,release_year,age_certification,runtime_mins,genres,production_countries,imdb_id,imdb_score,imdb_votes,drama,comedy,action,family,crime,romance,month_year
2022-03-06,TV (Non-English),7,10790000,2,forecasting love and weather,SHOW,"Inside a national weather service, love proves just as difficult to predict as rain or shine for a diligent forecaster and her free-spirited co-worker.",2022,TV-14,66.0,"drama, romance",South Korea,tt15140592,7.1,1617.0,1,0,0,0,0,1,2022-03
2022-03-06,TV (Non-English),8,10780000,1,midnight at the pera palace,SHOW,"At a historic Istanbul hotel, a journalist is unexpectedly thrust into the past and must stop a plot that could change the fate of modern Turkey.",2022,TV-14,44.0,"thriller, drama, history",Turkey,tt13317508,7.0,7377.0,1,0,0,0,0,0,2022-03
2022-03-06,TV (Non-English),9,10490000,1,thirty-nine,SHOW,"Leaning on each other through thick and thin, a trio of best friends stand together as they experience life, love and loss on the brink of turning 40.",2022,TV-MA,73.0,"drama, romance",South Korea,tt15309342,7.9,150.0,1,0,0,0,0,1,2022-03
2022-03-06,TV (Non-English),10,10400000,5,dark desire,SHOW,"Married Alma spends a fateful weekend away from home that ignites passion, ends in tragedy and leads her to question the truth about those close to her.",2020,TV-MA,34.0,"thriller, drama",Mexico,tt12540080,6.5,7420.0,1,0,0,0,0,0,2022-03
2022-02-27,Films (English),3,17440000,2,texas chainsaw massacre,MOVIE,"After nearly 50 years of hiding, Leatherface returns to terrorize a group of idealistic influencers who accidentally disrupt his carefully shielded world in a remote Texas town.",2022,R,83.0,"horror, thriller, crime",United States,tt11755740,4.8,48828.0,0,0,0,0,1,0,2022-02
2022-02-27,Films (English),4,9910000,2,downfall: the case against boeing,MOVIE,Investigators reveal how Boeing’s alleged priority of profit over safety could have contributed to two catastrophic crashes within months of each other.,2022,R,89.0,documentation,United States,tt11893274,7.4,10313.0,0,0,0,0,0,0,2022-02
2022-02-27,Films (English),5,9750000,4,despicable me 2,movie,"When Gru, the world's most super-bad turned super-dad has been recruited by a team of officials to stop lethal muscle and a host of Gru's own, He has to fight back with new gadgetry, cars, and more minion madness.",2013,PG,98.0,"animation, adventure, comedy","United States, France, Japan",tt1690953,7.3,400620.0,0,1,0,0,0,0,2022-02
2022-02-27,Films (English),6,7560000,2,fistful of vengeance,MOVIE,A revenge mission becomes a fight to save the world from an ancient threat when superpowered assassin Kai tracks a killer to Bangkok.,2022,R,94.0,"fantasy, action, crime, drama",United States,tt14158554,4.4,6341.0,1,0,1,0,1,0,2022-02
2022-02-27,Films (English),8,7330000,2,abominable,movie,Three teenagers must help a Yeti return to his family while avoiding a wealthy man and a zoologist who want him for their own needs.,2019,PG,97.0,"animation, adventure, comedy","United States, China, Japan",tt6324278,7.0,38753.0,0,1,0,0,0,0,2022-02
2022-02-27,Films (English),9,5590000,4,despicable me,movie,"When a criminal mastermind uses a trio of orphan girls as pawns for a grand scheme, he finds their love is profoundly changing him for the better.",2010,PG,95.0,"animation, adventure, comedy","United States, France",tt1323594,7.6,546417.0,0,1,0,0,0,0,2022-02
2022-02-27,Films (English),10,4970000,13,red notice,MOVIE,"An Interpol-issued Red Notice is a global alert to hunt and capture the world's most wanted. But when a daring heist brings together the FBI's top profiler and two rival criminals, there's no telling what will happen.",2021,PG-13,117.0,"thriller, action, comedy, crime",United States,tt7991608,6.3,264194.0,0,1,1,0,1,0,2022-02
2022-02-27,Films (Non-English),1,19810000,1,restless,MOVIE,"After going to extremes to cover up an accident, a corrupt cop's life spirals out of control when he starts receiving threats from a mysterious witness.",2022,R,95.0,"thriller, action, crime","Belgium, France",tt14465894,5.8,4174.0,0,0,1,0,1,0,2022-02
2022-02-27,Films (Non-English),3,7760000,4,through my window,MOVIE,"Raquel's longtime crush on her next-door neighbor turns into something more when he starts developing feelings for her, despite his family's objections.",2022,R,116.0,"drama, romance, comedy",Spain,tt14463484,5.4,9082.0,1,1,0,0,0,1,2022-02
2022-02-27,Films (Non-English),5,4820000,2,parallel mothers,movie,The story of two mothers who bond in unexpected way after giving birth the same day.,2021,R,123.0,drama,"Spain, France",tt12618926,7.1,29164.0,1,0,0,0,0,0,2022-02
2022-02-27,Films (Non-English),9,3310000,1,compadres,movie,"As former cop Garza seeks revenge on Santos, the crime lord who framed him, he forms an unlikely team with a young hacker who successfully stole $10 million from Santos.",2016,R,101.0,"action, comedy, crime",Mexico,tt3367294,4.8,1077.0,0,1,1,0,1,0,2022-02
2022-02-27,TV (English),1,130800000,3,inventing anna,SHOW,"A journalist with a lot to prove investigates the case of Anna Delvey, the Instagram-legendary German heiress who stole the hearts of New York’s social scene – and stole their money as well.",2022,TV-MA,68.0,drama,United States,tt8740976,6.8,61061.0,1,0,0,0,0,0,2022-02
2022-02-27,TV (English),2,80560000,1,vikings: valhalla,SHOW,"In this sequel to ""Vikings,"" a hundred years have passed and a new generation of legendary heroes arises to forge its own destiny — and make history.",2022,TV-MA,51.0,"war, action, drama, history, romance",United States,tt11311302,7.1,34833.0,1,0,1,0,0,1,2022-02
2022-02-27,TV (English),3,53600000,3,love is blind,SHOW,"Singles who want to be loved for who they are, rather than what they look like, have signed up for a less conventional approach to modern dating.",2020,TV-MA,54.0,"reality, romance",United States,tt11704040,6.1,7863.0,0,0,0,0,0,1,2022-02
2022-02-27,TV (English),4,33750000,2,one of us is lying,series,"A brain, an athlete, a princess, a criminal and a ""basket case"" walk into detention--but only the first four make it out alive.",2021,TV-MA,1.0,"crime, drama, mystery",United States,tt8354062,6.8,9458.0,1,0,0,0,1,0,2022-02
2022-02-27,TV (English),5,20850000,2,the cuphead show!,SHOW,Follow the misadventures of the impulsive Cuphead and his cautious but persuadable brother Mugman in this animated series based on the hit video game.,2022,TV-Y7,15.0,"animation, comedy, family, fantasy, action",United States,tt10611608,7.4,6513.0,0,1,1,1,0,0,2022-02
2022-02-27,TV (English),6,18610000,4,sweet magnolias,SHOW,"Lifelong friends Maddie, Helen and Dana Sue lift each other as they juggle relationships, family and careers in the small, Southern town of Serenity.",2020,TV-14,5.0,"drama, romance",United States,tt9077540,7.3,17689.0,1,0,0,0,0,1,2022-02
2022-02-27,TV (English),7,12860000,6,ozark,SHOW,"A financial adviser drags his family from Chicago to the Missouri Ozarks, where he must launder $500 million in five years to appease a drug boss.",2017,TV-MA,6.0,"drama, crime, thriller",United States,tt5071412,8.5,300454.0,1,0,0,0,1,0,2022-02
2022-02-27,TV (English),8,12320000,1,space force,SHOW,A four-star general begrudgingly teams up with an eccentric scientist to get the U.S. military's newest agency — Space Force — ready for lift-off.,2020,TV-MA,3.0,comedy,United States,tt9612516,6.7,63379.0,0,1,0,0,0,0,2022-02
2022-02-27,TV (English),9,11760000,4,raising dion,SHOW,A widowed single mom discovers that her son has super powers and tries to figure out how to raise him safely and responsibly.,2019,TV-G,43.0,"scifi, drama",United States,tt7826108,7.1,14799.0,1,0,0,0,0,0,2022-02
2022-02-27,TV (English),10,11460000,1,jeen-yuhs: a kanye trilogy,series,"Follows the life of Kanye West, in an intimate portrait as he builds his way from singer to businessman and becomes a global brand.",2022,TV-MA,27.0,"documentary, music",United States,tt14599438,8.0,9120.0,0,0,0,0,0,0,2022-02
2022-02-27,TV (Non-English),1,38860000,5,all of us are dead,SHOW,A high school becomes ground zero for a zombie virus outbreak. Trapped students must fight their way out — or turn into one of the rabid infected.,2022,TV-MA,61.0,"action, drama, scifi, horror, thriller, fantasy",South Korea,tt14169960,7.5,45027.0,1,0,1,0,0,0,2022-02
2022-02-27,TV (Non-English),3,17410000,1,juvenile justice,SHOW,A tough judge balances her aversion to minor offenders with firm beliefs on justice and punishment as she tackles complex cases inside a juvenile court.,2022,TV-MA,61.0,"drama, crime",South Korea,tt15553922,8.0,2633.0,1,0,0,0,1,0,2022-02
2022-02-27,TV (Non-English),4,15010000,4,dark desire,SHOW,"Married Alma spends a fateful weekend away from home that ignites passion, ends in tragedy and leads her to question the truth about those close to her.",2020,TV-MA,34.0,"thriller, drama",Mexico,tt12540080,6.5,7420.0,1,0,0,0,0,0,2022-02
2022-02-27,TV (Non-English),5,12750000,3,toy boy,SHOW,"After seven years in a Málaga prison, a male stripper is released pending retrial and sets out to prove his lover framed him for her husband's murder.",2019,TV-MA,61.0,"drama, thriller, crime, action",Spain,tt8693266,6.5,7526.0,1,0,1,0,1,0,2022-02
2022-02-27,TV (Non-English),6,12700000,3,toy boy,SHOW,"After seven years in a Málaga prison, a male stripper is released pending retrial and sets out to prove his lover framed him for her husband's murder.",2019,TV-MA,61.0,"drama, thriller, crime, action",Spain,tt8693266,6.5,7526.0,1,0,1,0,1,0,2022-02
2022-02-27,TV (Non-English),7,11850000,1,twenty five twenty one,SHOW,"The dreams of two young people are crushed by an overwhelming financial crisis in the 1990s. But when they reunite at the ages of 25 and 21, the spirited pair finds friendship and affection in times of adversity as they venture into adulthood together.",2022,TV-14,76.0,"drama, romance",South Korea,tt17513352,8.7,5746.0,1,0,0,0,0,1,2022-02
2022-02-27,TV (Non-English),8,11080000,2,fishbowl wives,SHOW,"Due to an accident, Sakura Hiraga gave up on her dream. She is now married and her husband runs a hair salon. They live in a luxurious penthouse apartment. Her life seems glamorous and she is envied by everyone. What everyone does not know is that Sakura Hiraga is abused physically and verbally by her husband. She is unable to leave her situation. Sakura Hiraga considers herself a goldfish in a fishbowl. One day, due to a goldfish, she meets a man.",2022,TV-MA,43.0,"drama, romance",Japan,tt15410190,6.1,907.0,1,0,0,0,0,1,2022-02
2022-02-27,TV (Non-English),9,11020000,1,forecasting love and weather,SHOW,"Inside a national weather service, love proves just as difficult to predict as rain or shine for a diligent forecaster and her free-spirited co-worker.",2022,TV-14,66.0,"drama, romance",South Korea,tt15140592,7.1,1617.0,1,0,0,0,0,1,2022-02
2022-02-27,TV (Non-English),10,10420000,2,"devotion, a story of love and desire",SHOW,"Fidelity tells a story of marital fidelity, in particular the one of Carlo and Margherita, a young couple who needs to face the deflagrant consequences of an alleged betrayal. Their relationship becomes a symbol of fidelity, not only as a couple, but also in the personal choices made every day.",2022,TV-MA,4.0,"drama, romance",Italy,tt13956560,6.4,1500.0,1,0,0,0,0,1,2022-02
2022-02-20,Films (English),2,29180000,1,texas chainsaw massacre,MOVIE,"After nearly 50 years of hiding, Leatherface returns to terrorize a group of idealistic influencers who accidentally disrupt his carefully shielded world in a remote Texas town.",2022,R,83.0,"horror, thriller, crime",United States,tt11755740,4.8,48828.0,0,0,0,0,1,0,2022-02
2022-02-20,Films (English),4,18300000,1,fistful of vengeance,MOVIE,A revenge mission becomes a fight to save the world from an ancient threat when superpowered assassin Kai tracks a killer to Bangkok.,2022,R,94.0,"fantasy, action, crime, drama",United States,tt14158554,4.4,6341.0,1,0,1,0,1,0,2022-02
2022-02-20,Films (English),5,11510000,3,despicable me 2,movie,"When Gru, the world's most super-bad turned super-dad has been recruited by a team of officials to stop lethal muscle and a host of Gru's own, He has to fight back with new gadgetry, cars, and more minion madness.",2013,PG,98.0,"animation, adventure, comedy","United States, France, Japan",tt1690953,7.3,400620.0,0,1,0,0,0,0,2022-02
2022-02-20,Films (English),6,8960000,1,abominable,movie,Three teenagers must help a Yeti return to his family while avoiding a wealthy man and a zoologist who want him for their own needs.,2019,PG,97.0,"animation, adventure, comedy","United States, China, Japan",tt6324278,7.0,38753.0,0,1,0,0,0,0,2022-02
2022-02-20,Films (English),7,7640000,1,st. vincent,MOVIE,"A young boy whose parents just divorced finds an unlikely friend and mentor in the misanthropic, bawdy, hedonistic, war veteran who lives next door.",2014,PG-13,102.0,"comedy, drama",United States,tt2170593,7.2,102820.0,1,1,0,0,0,0,2022-02
2022-02-20,Films (English),8,7420000,1,downfall: the case against boeing,MOVIE,Investigators reveal how Boeing’s alleged priority of profit over safety could have contributed to two catastrophic crashes within months of each other.,2022,R,89.0,documentation,United States,tt11893274,7.4,10313.0,0,0,0,0,0,0,2022-02
2022-02-20,Films (English),9,7170000,3,despicable me,movie,"When a criminal mastermind uses a trio of orphan girls as pawns for a grand scheme, he finds their love is profoundly changing him for the better.",2010,PG,95.0,"animation, adventure, comedy","United States, France",tt1323594,7.6,546417.0,0,1,0,0,0,0,2022-02
2022-02-20,Films (English),10,7030000,1,the vanishing,movie,"Rex and Saskia, a young couple in love, are on vacation. They stop at a busy service station and Saskia is abducted. After three years and no sign of Saskia, Rex begins receiving letters from the abductor.",1988,Not Rated,107.0,"mystery, thriller","Netherlands, France, West Germany",tt0096163,7.7,39283.0,0,0,0,0,0,0,2022-02
2022-02-20,Films (Non-English),2,13300000,3,through my window,MOVIE,"Raquel's longtime crush on her next-door neighbor turns into something more when he starts developing feelings for her, despite his family's objections.",2022,R,116.0,"drama, romance, comedy",Spain,tt14463484,5.4,9082.0,1,1,0,0,0,1,2022-02
2022-02-20,Films (Non-English),3,8110000,2,bigbug,MOVIE,"Set in the world of 2045, where communities have robotic helpers, a group of suburbanites are locked in for their protection by their household robots, while a rogue, self-aware AI android revolt uprising takes place outside.",2022,R,111.0,"comedy, scifi, fantasy",France,tt11541872,5.4,7483.0,0,1,0,0,0,0,2022-02
2022-02-20,Films (Non-English),4,7420000,2,love and leashes,MOVIE,"Love never hurt so good for two co-workers who enter a contractual relationship as partners in consensual play, pleasure and pain.",2022,R,118.0,"comedy, romance",South Korea,tt15553956,6.3,4273.0,0,1,0,0,0,1,2022-02
2022-02-20,Films (Non-English),6,6510000,1,parallel mothers,movie,The story of two mothers who bond in unexpected way after giving birth the same day.,2021,R,123.0,drama,"Spain, France",tt12618926,7.1,29164.0,1,0,0,0,0,0,2022-02
2022-02-20,Films (Non-English),9,2510000,3,my best friend anne frank,MOVIE,"Based on the real-life friendship between Anne Frank and Hannah Goslar, from Nazi-occupied Amsterdam to their harrowing reunion in a concentration camp.",2021,PG-13,103.0,drama,Netherlands,tt10360772,6.2,4035.0,1,0,0,0,0,0,2022-02
2022-02-20,TV (English),1,195970000,2,inventing anna,SHOW,"A journalist with a lot to prove investigates the case of Anna Delvey, the Instagram-legendary German heiress who stole the hearts of New York’s social scene – and stole their money as well.",2022,TV-MA,68.0,drama,United States,tt8740976,6.8,61061.0,1,0,0,0,0,0,2022-02
2022-02-20,TV (English),2,58960000,2,love is blind,SHOW,"Singles who want to be loved for who they are, rather than what they look like, have signed up for a less conventional approach to modern dating.",2020,TV-MA,54.0,"reality, romance",United States,tt11704040,6.1,7863.0,0,0,0,0,0,1,2022-02
2022-02-20,TV (English),3,29760000,3,sweet magnolias,SHOW,"Lifelong friends Maddie, Helen and Dana Sue lift each other as they juggle relationships, family and careers in the small, Southern town of Serenity.",2020,TV-14,5.0,"drama, romance",United States,tt9077540,7.3,17689.0,1,0,0,0,0,1,2022-02
2022-02-20,TV (English),4,17990000,5,ozark,SHOW,"A financial adviser drags his family from Chicago to the Missouri Ozarks, where he must launder $500 million in five years to appease a drug boss.",2017,TV-MA,6.0,"drama, crime, thriller",United States,tt5071412,8.5,300454.0,1,0,0,0,1,0,2022-02
2022-02-20,TV (English),5,17550000,3,raising dion,SHOW,A widowed single mom discovers that her son has super powers and tries to figure out how to raise him safely and responsibly.,2019,TV-G,43.0,"scifi, drama",United States,tt7826108,7.1,14799.0,1,0,0,0,0,0,2022-02
2022-02-20,TV (English),6,15390000,1,one of us is lying,series,"A brain, an athlete, a princess, a criminal and a ""basket case"" walk into detention--but only the first four make it out alive.",2021,TV-MA,1.0,"crime, drama, mystery",United States,tt8354062,6.8,9458.0,1,0,0,0,1,0,2022-02
2022-02-20,TV (English),7,14630000,1,the cuphead show!,SHOW,Follow the misadventures of the impulsive Cuphead and his cautious but persuadable brother Mugman in this animated series based on the hit video game.,2022,TV-Y7,15.0,"animation, comedy, family, fantasy, action",United States,tt10611608,7.4,6513.0,0,1,1,1,0,0,2022-02
2022-02-20,TV (English),8,14140000,3,raising dion,SHOW,A widowed single mom discovers that her son has super powers and tries to figure out how to raise him safely and responsibly.,2019,TV-G,43.0,"scifi, drama",United States,tt7826108,7.1,14799.0,1,0,0,0,0,0,2022-02
2022-02-20,TV (English),9,12300000,2,disenchantment,SHOW,"Set in a ruined medieval city called Dreamland, Disenchantment follows the grubby adventures of a hard-drinking princess, her feisty elf companion and her personal demon.",2018,TV-14,28.0,"scifi, comedy, fantasy, animation, action",United States,tt5363918,7.2,59907.0,0,1,1,0,0,0,2022-02
2022-02-20,TV (English),10,11040000,4,the woman in the house across the street from the girl in the window,SHOW,"For Anna, every day is the same. She sits with her wine, staring out the window, watching life go by without her. But when a handsome neighbor moves in across the street, Anna starts to see a light at the end of the tunnel. That is until she witnesses a gruesome murder… Or did she?",2022,TV-MA,26.0,"thriller, crime, drama, comedy",United States,tt13315324,6.3,41822.0,1,1,0,0,1,0,2022-02
2022-02-20,TV (Non-English),1,62130000,4,all of us are dead,SHOW,A high school becomes ground zero for a zombie virus outbreak. Trapped students must fight their way out — or turn into one of the rabid infected.,2022,TV-MA,61.0,"action, drama, scifi, horror, thriller, fantasy",South Korea,tt14169960,7.5,45027.0,1,0,1,0,0,0,2022-02
2022-02-20,TV (Non-English),3,23810000,2,toy boy,SHOW,"After seven years in a Málaga prison, a male stripper is released pending retrial and sets out to prove his lover framed him for her husband's murder.",2019,TV-MA,61.0,"drama, thriller, crime, action",Spain,tt8693266,6.5,7526.0,1,0,1,0,1,0,2022-02
2022-02-20,TV (Non-English),4,22950000,3,dark desire,SHOW,"Married Alma spends a fateful weekend away from home that ignites passion, ends in tragedy and leads her to question the truth about those close to her.",2020,TV-MA,34.0,"thriller, drama",Mexico,tt12540080,6.5,7420.0,1,0,0,0,0,0,2022-02
2022-02-20,TV (Non-English),5,21460000,2,toy boy,SHOW,"After seven years in a Málaga prison, a male stripper is released pending retrial and sets out to prove his lover framed him for her husband's murder.",2019,TV-MA,61.0,"drama, thriller, crime, action",Spain,tt8693266,6.5,7526.0,1,0,1,0,1,0,2022-02
2022-02-20,TV (Non-English),6,18880000,1,"devotion, a story of love and desire",SHOW,"Fidelity tells a story of marital fidelity, in particular the one of Carlo and Margherita, a young couple who needs to face the deflagrant consequences of an alleged betrayal. Their relationship becomes a symbol of fidelity, not only as a couple, but also in the personal choices made every day.",2022,TV-MA,4.0,"drama, romance",Italy,tt13956560,6.4,1500.0,1,0,0,0,0,1,2022-02
2022-02-20,TV (Non-English),7,15940000,1,fishbowl wives,SHOW,"Due to an accident, Sakura Hiraga gave up on her dream. She is now married and her husband runs a hair salon. They live in a luxurious penthouse apartment. Her life seems glamorous and she is envied by everyone. What everyone does not know is that Sakura Hiraga is abused physically and verbally by her husband. She is unable to leave her situation. Sakura Hiraga considers herself a goldfish in a fishbowl. One day, due to a goldfish, she meets a man.",2022,TV-MA,43.0,"drama, romance",Japan,tt15410190,6.1,907.0,1,0,0,0,0,1,2022-02
2022-02-20,TV (Non-English),8,12590000,3,dark desire,SHOW,"Married Alma spends a fateful weekend away from home that ignites passion, ends in tragedy and leads her to question the truth about those close to her.",2020,TV-MA,34.0,"thriller, drama",Mexico,tt12540080,6.5,7420.0,1,0,0,0,0,0,2022-02
2022-02-20,TV (Non-English),9,11420000,14,the queen of flow,SHOW,"After spending seventeen years in prison unfairly, a talented songwriter seeks revenge on the men who sank her and killed her family.",2018,TV-MA,45.0,"drama, family, music",Columbia,tt8560918,7.7,1247.0,1,0,0,1,0,0,2022-02
2022-02-20,TV (Non-English),10,10320000,13,"yo soy betty, la fea",series,"An outcast in a prominent fashion company, a sweet-hearted and unattractive assistant falls hopelessly in love with her boss.",1999,TV-PG,3.0,"comedy, drama, romance",Colombia,tt0233127,8.2,3286.0,1,1,0,0,0,1,2022-02
2022-02-13,Films (English),4,13080000,2,despicable me 2,movie,"When Gru, the world's most super-bad turned super-dad has been recruited by a team of officials to stop lethal muscle and a host of Gru's own, He has to fight back with new gadgetry, cars, and more minion madness.",2013,PG,98.0,"animation, adventure, comedy","United States, France, Japan",tt1690953,7.3,400620.0,0,1,0,0,0,0,2022-02
2022-02-13,Films (English),5,10550000,3,home team,MOVIE,"Two years after a Super Bowl win when NFL head coach Sean Payton is suspended, he goes back to his hometown and finds himself reconnecting with his 12-year-old son by coaching his Pop Warner football team.",2022,PG,95.0,"family, comedy, sport",United States,tt14592064,6.0,17767.0,0,1,0,1,0,0,2022-02
2022-02-13,Films (English),6,8950000,2,despicable me,movie,"When a criminal mastermind uses a trio of orphan girls as pawns for a grand scheme, he finds their love is profoundly changing him for the better.",2010,PG,95.0,"animation, adventure, comedy","United States, France",tt1323594,7.6,546417.0,0,1,0,0,0,0,2022-02
2022-02-13,Films (English),7,8750000,1,dora and the lost city of gold,movie,"Dora, a teenage explorer, leads her friends on an adventure to save her parents and solve the mystery behind a lost city of gold.",2019,PG,102.0,"action, adventure, comedy","United States, Australia",tt7547410,6.1,31166.0,0,1,1,0,0,0,2022-02
2022-02-13,Films (English),8,6850000,2,faster,movie,An ex-con gets on a series of apparently unrelated killings. He gets tracked by a veteran cop with secrets of his own and an egocentric hit man.,2010,R,98.0,"action, crime, drama",United States,tt1433108,6.4,107852.0,1,0,1,0,1,0,2022-02
2022-02-13,Films (English),9,5460000,3,the power of the dog,MOVIE,"Charismatic rancher Phil Burbank inspires fear and awe in those around him. When his brother brings home a new wife and her son, Phil torments them until he finds himself exposed to the possibility of love.",2021,R,126.0,"drama, romance, western","United Kingdom, Australia, Canada, Greece, New Zealand",tt10293406,6.8,164844.0,1,0,0,0,0,1,2022-02
2022-02-13,Films (English),10,5360000,8,don't look up,MOVIE,Two American astronomers attempt to warn humankind about an approaching comet that will wipe out life on planet Earth.,2021,R,138.0,"comedy, drama, scifi",United States,tt11286314,7.2,515337.0,1,1,0,0,0,0,2022-02
2022-02-13,Films (Non-English),1,34700000,2,through my window,MOVIE,"Raquel's longtime crush on her next-door neighbor turns into something more when he starts developing feelings for her, despite his family's objections.",2022,R,116.0,"drama, romance, comedy",Spain,tt14463484,5.4,9082.0,1,1,0,0,0,1,2022-02
2022-02-13,Films (Non-English),5,6680000,1,love and leashes,MOVIE,"Love never hurt so good for two co-workers who enter a contractual relationship as partners in consensual play, pleasure and pain.",2022,R,118.0,"comedy, romance",South Korea,tt15553956,6.3,4273.0,0,1,0,0,0,1,2022-02
2022-02-13,Films (Non-English),6,5680000,2,my best friend anne frank,MOVIE,"Based on the real-life friendship between Anne Frank and Hannah Goslar, from Nazi-occupied Amsterdam to their harrowing reunion in a concentration camp.",2021,PG-13,103.0,drama,Netherlands,tt10360772,6.2,4035.0,1,0,0,0,0,0,2022-02
2022-02-13,Films (Non-English),7,4400000,1,bigbug,MOVIE,"Set in the world of 2045, where communities have robotic helpers, a group of suburbanites are locked in for their protection by their household robots, while a rogue, self-aware AI android revolt uprising takes place outside.",2022,R,111.0,"comedy, scifi, fantasy",France,tt11541872,5.4,7483.0,0,1,0,0,0,0,2022-02
2022-02-13,TV (English),1,77310000,1,inventing anna,SHOW,"A journalist with a lot to prove investigates the case of Anna Delvey, the Instagram-legendary German heiress who stole the hearts of New York’s social scene – and stole their money as well.",2022,TV-MA,68.0,drama,United States,tt8740976,6.8,61061.0,1,0,0,0,0,0,2022-02
